{
	"$schema": "config.schema.json",
	"notionDatabaseId": "",
	"notionDataSourceId": "",
	"inputFile": "input.json",
	"skipExisting": {
		"enabled": false,
		"jsonKey": "keyInJSON",
		"notionProperty": "ItemId",
		"propertyType": "rich_text"
	},
	"missingInInputPolicy": {
		"policy": "noAction",
		"jsonKey": "keyInJSON",
		"notionProperty": "ItemId",
		"propertyType": "rich_text",
		"alertedNotionProperty": "ItemName",
		"alertedPropertyType": "title"
	},
	"writeErroredObjectsToFile": true,
	"propertyMappings": [
		{
			"jsonKey": "keyInJson",
			"notionPropertyName": "keyInNotion",
			"notionPropertyType": "rich_text",
			"nestedObjectPolicy": {
				"policy": "usePriorityList",
				"priorityList": [
					"highestPriorityProperty",
					"secondHighestPriorityProperty"
				]
			}
		}
	],
	"extraProperties": [
		{
			"notionPropertyName": "Imported by",
			"propertyValue": "Imported using JSON to Notion",
			"notionPropertyType": "rich_text"
		}
	]
}